{
  "schemaVersion": 1,
  "updatedAt": "2026-10-29",
  "layouts": [],
  "regulations": [],
  "vehicles": [],
  "settings": [
    {
      "id": "vehicle-parts-master",
      "name": "車両パーツ・ボディ固定マスター",
      "path": "settings/vehicle-parts-master.json",
      "version": 2
    },
    {
      "id": "mr04evo2-compatibility",
      "name": "MR-04EVO2 パーツ適合データ",
      "path": "settings/mr04evo2-compatibility.json",
      "version": 1
    }
  ],
  "lapRecords": []
}
